Description,ASIN,Product Description,Manufacturer
Meant for 15.6-inch laptops    Multiple compartments for additional accessories    Front big pocket for quick-access your essentials    Elegant and Lightweight Cross-dyed woven fabric    Finished in Stylish warm dark grey and stretch to shoulder strap    Laptop compartment fits up to 15.6 inch laptop with velcro laptop strip    ASUS reflective logo    1 Year hardware warranty provided by the manufacturer from date of purchase,B0895ZZHKK,"ASUS BP1504 offers stylish, elegant protection for laptops with displays up to 15.6 inch. Elegant and lightweight Cross-dyed Woven Fabric making for a truly beautiful accessory to any NoteBook laptop.",Unknown
"Superior & Durability: Made of durable and Eco-friendly water resistant oxford textile fabric,which keeps your files and stuffs dry inside. This backpack can hold up to 15.6"" laptop from most brands, but it may not be suitable for all brand 15.6"". Since there maybe exist slight size difference among different laptop brands.     Lining Description: Polyester; Style Name: Traditional; Pocket Description: Utility Pocket; Closure Type: Zipper; Material Type: Polyester; Age Range Description: Adult; Pattern Name: Solid; Special Features: Laptop Compartment",B09VCHV6T5,Not Mentioned,
"Canvas Messenger Bag provide style and comfort in short trip with super quality. Dimension: 30Lx13Wx26H CM Color: Dark Green Material: Canvas Cotton; Travel Crossbody Bag Closure Type: Zipper Closure Canvas Bag Strap Type: Crossbody Sling Bag    Canvas Messenger Bag with 5 Compartment: 2 Main zipper compartment, 1 rear side zipper pocket,2 front pocket, and 2 side pockets. More convenient and easier to organize your stuff.    Spacious Interior for Weekend Travel Bag: Canvas Sling Bag Pockets: Main compartment with plenty of room for clothes, toiletries, and portable electronic devices. Side Pockets for water bottles and    Messenger Bag with Multiple Compartment : We have made changes in quality as per the review we received in addition we also provide 6 Months Warranty on products quality.; Occasion Type: Casual    Age Range Description: Adult",B07Q74QLHT,Not Mentioned,
"Closure: Zipper    INNOVATIVE DESIGN: Utility of a Messenger Bag with Convenience of a Laptop Sleeve. The all new Informal is a versatile semi-formal laptop bag handcrafted to accommodate all your professional belongings. Material of Laptop Messenger Bag is Premium Canvas which is waterproof, YKK Zippers and Comfortable shoulder strap and grabs handles.    SPACIOUS: 2 compartments for up to a 15” laptop or tablet, hard disk, file, notebook, cheque book and other documents. 3 internal open pockets for a mobile phone, charger or a power bank and other utilities. 1 quick-access vertical zipper in the front.    TRAVEL FRIENDLY: The bag is made of soft and environmentally friendly materials with reinforced edges and good padding of the main compartment offer well protection for your laptop.    COMPATIBLE for all the major brands of 15.6"" Laptops    MADE IN INDIA with 1 Yr Warranty",B07X6DV3VM,"Main compartment dedicated for laptop & iPad & Tablet padded with soft imported fur lining. It provide 360 degree protection to your devices.  



 Large & equal size zippered pockets on front side of bag allows to store other accessories like smartphone, power adapter, power cable, mouse, couple of pen, passport, powerbank, etc.  



 Side opening design allows you to easily slide your laptop & tablet with better protection.",AirCase
"Material: This bag is made from Nylon with polyester lining which is waterproof. Unisex backpack for men and women     Compartments: 4 compartments including 1 main compartment for 15.6 inch laptop, 2 zippers at side, 1 anti-theft zipper at back keeping your wallet, cards and phone safe, 2 additional water pouches, Multiple interior slot pocket for your other belonging such as notebook, tablet, phones, water bottle. USB charging slot with ear phone hole     Capacity: 35-45 litres capacity used for daily office goers. Also used as travelling, hiking, trekking backpack     Accurate air bubbles reduces excess weight and stress by 55 % on your shoulders and Back tough air mesh cushion supports your spinal during long go     Compartment Description: Not Laptop Compatible; Age Range Description: Adult; Special Features: Laptop Compartment",B07XYY2FW4,Not Mentioned,Unknown
"Care Instructions: Hand Wash Only    Large multi-compartment backpack with a padded sleeve for laptops, Holds up to 15 inches Laptop     Water Resistance PU Coated Durable Fabric, with padded back section for comfortable carry     Front Organizer compartments for pens, keys, and cell phone     Age Range Description: Adult; Strap Type: Cross-Body; Warranty Description: Warranty: 1 Year Warranty Against Manufacturing Defects.; Pattern Name: Solid; Closure Type: Zipper; Water Resistance Level: Water Resistant; Pocket Description: Utility Pocket",B078JVT384,"Designed to give ultimate comfort, this school bag from Cosmus is a Multipurpose Backpack Bag use it as school bag or regular casual backpack for daily use.  This school bag is designed with copious space and sturdy shoulder straps to help children accommodate all essentials while on the move. Key Features High on quality and durability Attractive design Spacious to accommodate all essentials Two main compartment, two front compartment Two side Mesh pockets Specifications Material PU coated Polyester Fabric. Dimensions: 13 x 18 x 8.5 [inches] (WxHxD); Weight: 755 gms Suggestive Age - 8 Years+",Cosmus
"BACKPACK FOR PROFESSIONALS: Backpack with Laptop Compartment and organization for Books & other items. A spacious main compartments & one Front Zipper Pocket. A great backpack for working professionals and students     DURABLE MATERIAL: Extra-large backpack: 18x12x06 (inches), Capacity: 22L separate laptop compartment hold for 15.6 inches Laptop. The Large backpack made from high quality polyester fabric. Laptop pocket designed for your laptops to give them maximum security. It comes with Pen Pocket and Power Bank Pocket which aids in organising your things systematically     SMART & EFFICIENT: This big backpack is crafted specially for professional needs. This bag accommodate your daily essentials with ease. It can easily carry your work from office to home while giving you some space for your needs too. Most suitable for working professional along with college students.     COMFORTABLE: This backpack comes with comfortable wide breathable shoulder straps well-padded materials that helps relieve the stress from your shoulder. It has adjustable chest straps for equal weight-distribution. Along with compact-squeezing straps that lets you squeeze your, while making it look slimmer, providing extra strength for heavy articles too.; WARRANTY: Cosmus Branded Backpack comes with One year Manufacturer Warranty.; Age Range Description: Adult     Pattern Name: Solid",B08R7M639Z,Not Mentioned,Unknown
"Laptop Compatibility: Yes, Laptop size: 15.6 inches    Outer Material: Polyester, Color: Black    Water Resistance: Water resistant    Dimensions: 33 cms x 17.5 cms x 47 cms (LxWxH)    Warranty type: Manufacturer; 12 months warranty against manufacturing defects",B01LXNNFDF,Not Mentioned,Backpack International Pvt Ltd
"Made with strong and premium 450D Polyester    Max padded 15.4"" Laptop compartment    Cool and stylish looks    Unique front quick access mesh pockets    Large front pocket for extra convenience",B0BP1QM6W5,"Made with strong and premium 450D Polyester Max padded 15.4"" Laptop compartment Cool and stylish looks Unique front quick access mesh pockets Large front pocket for extra convenience Available in smart colors",Backpack International Pvt Ltd
Care Instructions: Wipe with Damp Cloth    Number Lock: This Fur Jaden Anti Theft laptop backpack comes equipped with a Number Lock. This helps keep your laptop and other belongings safe when you need to leave your bag unattended in a public space. The number lock sequence can be changed and customised by your directly.    USB Charging Port: Now charge your devices on the go with your new Fur Jaden backpack without the hassle of carrying a bulk power bank in your pocket/ hand at all times.    Ergonomic Design: This backpack has been designed to ensure equal weight distribution on your shoulders along with padded shoulder straps and breathable air mesh on the back.    Dimension: 42 CM (L) x 30 CM (W) x 18 CM (D). Storage Capacity: 25L. Weight: 600 Grams; Warranty: 1 Year Manufacturer Warranty against Manufacturing Defects    Closure Type: Zipper; Lining Description: Polyester; Age Range Description: Adult,B09VTCNN75,"Stay organized all day with a durable and lightweight backpack from Fur Jaden. This back pack is a stylish and functional accessory for men and women. Can add admiration to an appealing and daring personality with a remarkable aesthetics and functionality. This backpack features an anti-theft design. You can also charge your phone on the go and organize your stuff like pro. Fur Jaden functional back pack is apt to protect your gadgets and belongings from being stolen while you travel, thanks to its special anti-theft design. Now keep your belongings safe with style. The backpack features multiple compartments that you may use for your laptop and other essentials. A remarkable feature of this backpack allows you to charge your phone while you are on the move. With an attached charging dock in the back you may connect a portable power bank with ease. Weighing about 600grams, this backpack is lightweight. The backpack is able to house a laptop of up to 15.6 inches and has seven inner compartments to place your other essentials. Made from durable quality polymer this Fur Jaden back pack is sturdy and reliable. Flaunt this bag with style and low maintenance as this bag is washable. This backpack is also suitable for school or college. The straps are designed to distribute the weight equally on each shoulder preventing any sort of discomfort. Use this back pack for office, college/school or during travels.",FUR JADEN
"ROOMY ENOUGH : This bag is ultra lightweight comes with Three main compartment having the capacity of approx 55 Ltr, big enough to carry laptop of all sizes, books, clothes, camping gear; 4 main compartments to store all your essentials and 1 small front pockets to carry small accessories. It also features an Internal Organiser(small pockets inside a Backpack).     COMFORT WITH QUALITY: This Backpack has Wide, Padded and Adjustable shoulder straps and Padded Back for comfort in carrying heavy items. Stitched properly and Bartacks on every pressure point for extra durability. Made with strong yet light weight polyester fabric with heavy zippers. It also comes with a Rain cover so that you can travel during rainy season without any problem. It can be used by everyone be it men? , women? , boys , girls.     PROUDLY MADE IN INDIA: Half Moon is proud to be an Indian Brand. We understand the importance of Indian manufacturing and supply chains. It is the time when we revive local industries that's why this bag is Made in India by Indians using Indian materials.     QUALITY : A major problem in many rucksack/travelling bags is that it get torn between your journey but this Rucksack is strong enough to hold even the heaviest of your items without any problem. It is made up of a strong polyester material, is stitched properly, and is bartacked on every pressure points for extra strength.;Pocket Description: Utility Pocket; Age Range Description: Adult; Special Features: Back Padding;Pattern Name: Solid     OTHER FEATURES: Rain Cover, Internal Organiser(Small Pockets), Strong and durable zippers, Adjustable Shoulder Handles (Straps) , 2 Bottle/Umbrella holders , Padded Handle , Padded Laptop Compartment , Ergonomic Design, Reflector Logo, etc",B09WDBPVFW,"This backpack is lightweight water-resistant, capacity of approx 55 Ltr, has a soft and ventilated back panel, and is perfect for carrying all your necessities. Adjustable and breathable padded shoulder strap to meet different requirements for both men and women; made from highly rip and water-resistant polyester fabric, provide strengthen and long-lasting performance; roomy enough for your traveling requirements. Rain cover to protect your Backpack from rain.",Half_Moon
"INNOVATIVE DESIGN: Utility of a Messenger Bag with Convenience of a Laptop Sleeve. Built with Premium Waterproof Canvas with Impact Resistant Soft lining which prevents scratches.    CONVENIENT & COMFORTABLE: 1 Main compartment with attached Laptop Sleeve. 1 Back Pocket to organize accessories such as Charger, Power bank, Phone, Tablet, cable, Pen, Notebook, etc.    KEEPS YOUR BELONGINGS SAFE: This Hand Bag is made of Soft and Environmental Friendly Material with Reinforced Edges. Soft Padding of the Main Compartment offers Protection to your laptop.    TRAVEL FRIENDLY: It Comes with Adjustable & Removable Shoulder Strap for easy Portability. It can be carried as a Briefcase or carried as a Sling Bag as per convenience.    WIDELY COMPATIBLE : Made In India with 6 Months Warranty. Designed for most 15.6"" Laptops and Ultrabooks",error,Not Mentioned,Unknown
"Care Instructions: Wipe with Dry Cloth    PREMIUM MATERIAL: Made from high quality, Premium quality smooth zippers, pullers, buckles.    Superior & Durability: Made of durable and Eco-friendly water resistant oxford textile fabric,which keeps your files and stuffs dry inside. This backpack can hold up to 15.6"" laptop from most brands, but it may not be suitable for all brand 15.6"". Since there maybe exist slight size difference among different laptop brands.    Age Range Description: Adult; Style Name:cooper    USB FEATURE : External USB port with built-in charging cable enables convenient charging by connecting your power bank with your electronic devices.    EXPANDABLE",B0BKTQ48D5,Not Mentioned,rama luxury store
"Care Instructions: Hand Wash Only    Large multi-compartment backpack with a padded sleeve for laptops, Holds up to 15 inches Laptop     Water Resistance PU Coated Durable Fabric, with padded back section for comfortable carry     Front Organizer compartments for pens, keys, and cell phone     Age Range Description: Adult; Strap Type: Cross-Body; Warranty Description: Warranty: 1 Year Warranty Against Manufacturing Defects.; Pattern Name: Solid; Closure Type: Zipper; Water Resistance Level: Water Resistant; Pocket Description: Utility Pocket",B078JVT384,"Designed to give ultimate comfort, this school bag from Cosmus is a Multipurpose Backpack Bag use it as school bag or regular casual backpack for daily use.  This school bag is designed with copious space and sturdy shoulder straps to help children accommodate all essentials while on the move. Key Features High on quality and durability Attractive design Spacious to accommodate all essentials Two main compartment, two front compartment Two side Mesh pockets Specifications Material PU coated Polyester Fabric. Dimensions: 13 x 18 x 8.5 [inches] (WxHxD); Weight: 755 gms Suggestive Age - 8 Years+",Cosmus
"Crossbody Travel Pouch comes with 4 Zip Pocket storage Compartment for your iPad, tablet, mobile, diary, money, wallet, and other electronic gadget accessories and 1 Velcro compartment for small accessories.    Product Size: 6.5x3.5x9.5 Inch(LWH) inch, Color-Blue, Weekender Sling Bag is perfect to impress everyone with its excellent quality and unique design.    Made in India product, Consisting of premium quality stitching and high-grade zippers, this sling ensures long-lasting durability & strength.; Premium Quality Material is very durable and long-lasting life.    You can use this bag as a messenger bag, shoulder bag, suitable for your office, college, outdoor travels, university, meeting, and business for everyday use.    Department Name: Unisex-Adult",B0993Q72WD,"Spacious Storage   The laptop bag contains 4 Zip Pocket storage compartments for your iPad, tablet, mobile, diary, money, wallet, and other electronic gadget accessories and 1 Velcro compartment for small accessories.  



 Superior Material   The bag is made with superior quality fabric which not only looks good but also offers you utmost comfort.  



 Suitable For   The laptop bag is made suitable for men & women both which can be used on a daily basis.",
Sling Bag cum Pop it,B09N74VDY7,QBLYN . It scores high on the aspect of utility . It has a Compact design . This is what makes it worth the buy.,Unknown
"Material: Pu Leather , Color : Light Brown , Dimensions: 37x 27x7 cm, To analyse the size accurately, kindly read the dimension and check with any scale available to you before placing order.    Elegant look and high quality PU leather Ultra-soft felt, Long Lasting durable fabric With Zipper Closure and handle.; Compartments : 1 main zipper compartment & 1 inner compartment &1 inner Laptop compartment.    The messenger bag features a wide shoulder strap that eliminates shoulder fatigue. The bag can be carried by the handle, worn on shoulders, and positioned across body.    This computer bag fits laptops to 14 inches. Ideal for Professionals/Office going Men & Women. Slim, compact in size suitable for carrying business as well as day to day items like tablet, laptop, charger, phone, battery bank, pen, diary, visiting cards, keys etc.; Outer Material Type: Faux Leather; Inner Material Type: Polyester Fabric    Style Name: Shoulder Bag",B081GQJLD2,Not Mentioned,Unknown
"PREMIUM MATERIAL: This multifunctional bag is made of quality Water Repellent polyester material in black color to protect your goods from water. For the inner lining, soft feel premium polyester is used. The hardware such as strengthened hooks, zippers and buckles used are wear resistant, smooth, and durable.     LARGE CAPACITY : Comes with 2 compartments with one separate cushioned laptop sleeve to hold 15. 6 inch Laptop. Additional front zipper pockets with an organiser to store magazine, pens, key,music, cosmetic, pen, charger, powerbank, cable etc. Side pockets for water bottles,umbrella. Back hidden anti theft pocket can hold your wallet,phone,etc     TROLLEY STRAP & CONVENIENCE : The insertible pull rod box design allows the bag to slide over the luggage handle for easy mobility during traveling. Comfortable airflow back ergonomics design with soft padding, gives you maximum back support. Breathable and adjustable shoulder straps relieve the stress of shoulder. Foam padded top handle for a long time carry on.     ONE YEAR WARRANTY: 1-year warranty on this bag against any manufacturing defects. Just keep your documents safe. Contact Red Lemon for any issues regarding the product and a resolution will be provided.; Lining texture: polyester     Pattern Name: Solid; Special Features: Laptop Compartment; Age Range Description: Adult",B0BGSV19KZ,Not Mentioned,
school bag    backpack    college bag    Style Name: Casual; Water Resistance Level: Water Resistant; Strap Type: Cross-Body; Closure Type: Zipper; Age Range Description: Big Kid; Special Features: Laptop Compartment; Pattern Name: Solid,B09TRZ9CL2,"30% Extra Storage We Indians tend to carry a lot of stuff in our backpacks. Blufin Backpacks comes with spacious compartments. Maximized Comfort with Padded, Breathable Back System Its adjustable shoulder straps with padded air mesh and back padding ensure long-lasting comfort while carrying this backpack. Durable Its high-quality fabric and seam strength ensure that this backpack lasts long, even if you use it all day, everyday. Lightweight Eco-friendly Fabric Designed with an eco-friendly, virgin polyester fabric, this bag is lightweight and easy to carry. Water- and Stain-resistant Take this backpack with you everywhere you go, to office or to a trek, without worrying about damage as it’s stain-resistant and fluid-resistant.",bluecraft in telangana hyderabad
"Capicity: 21 Litres, Weight: 0.4kg; Dimensions: 45cmX29cmX16cm; Outer Material: Polyester; Inner Material: Polyester    Water Repellent: Yes; Laptop Compartment: Yes ; Compartments: 2,one front pocket to hold essentials and A mesh stash pocket on one side to accommodate a drinking bottle & other accessories.    Utility: Office, College, School, Camping, Weekend trip, Day trip    Accessories shown in the picture are not part of the bag.    Closure Type: Zipper; Strap Type: Adjustable; Age Range Description: Kid; Warranty Description: No Warranty; Style Name: Daypack Backpacks; Color Name: Blu-Wht; Water Resistance Level: Water Resistant",B07GXYHFCY,"Dzert Casual Backpack   Pump up your style quotient a notch higher as you step out carrying this Dzert's Casual Backpack. It has a vibrant and stylish design, along with the added benefit of spacious interiors. Made from polyester, this backpack features a blue colour along with the brand name in front.  



 Spacious Compartments   The bag has spacious compartments for carrying your belongings separately. There are also external pockets for carrying a bottle and other essentials.  



 Adjustable padded shoulder straps   This backpack comes with padded shoulder straps which can be adjusted according to your size for a customized fit. Furthermore, the broad straps distribute the weight of the backpack evenly across your shoulders.",Rushi Enterprise
Long lasting    It is durable    It is durable    Material: nylon-mesh    In-box contents: 1 gym bag,B01NBTOX54,Not Mentioned,Unknown
"Superior & Durability: Made of durable and Eco-friendly water resistant oxford textile fabric,which keeps your files and stuffs dry inside. This backpack can hold up to 15.6"" laptop from most brands, but it may not be suitable for all brand 15.6"". Since there maybe exist slight size difference among different laptop brands.     Lining Description: Polyester; Style Name: Traditional; Pocket Description: Utility Pocket; Closure Type: Zipper; Material Type: Polyester; Age Range Description: Adult; Pattern Name: Solid; Special Features: Laptop Compartment",B09VCHV6T5,Not Mentioned,
"2-main zippered compartment, one inside sleeve for laptop, a front pocket with an organizer.    One zippered front pocket, one mesh zippered pocket & two mesh pockets on both sides.    Thick padding anti-sweat breathable air mesh & adjustable padded shoulder straps.    World’s best Japanese brand YKK zippers and sliders.    Comes with the F Gear promise of quality and durability.",B097K6KD7W,F Gear presents gigantic laptop backpack blends style and functionality. It comes with substantial capacity to accommodate your laptop and several other essentials with ease. This bag does way more than just look good. It provides extra protection for all your valuable devices. The dimensions of the bag are - 34 x 22 x 52 with a capacity of 39 L. To describe it briefly here are the following points: 1. This backpack is made of polyester fabric and is treated to make it water-resistant. 2. This backpack comes with 2-main zippered compartment with an inside sleeve compatible for laptop. 3. This backpack has a front compartment with an organizer. 4. This backpack comes with one zippered front pocket & one quick access mesh zippered. 5. This backpack is equipped with thick padding with anti-sweat breathable air mesh & adjustable padded shoulder straps for extra comfort. 6. Apart from this it has world’s best Japanese brand YKK zippers and sliders. 7. This backpack has two mesh pockets on both sides. 8. Comes with the F Gear promise of quality and durability.,Uber Fashion Merchandise Pvt Ltd
"Body Builders    Zipper    Polyester    Width: 40 cm, Height: 22 cm, Depth: 20 cm    Sport Type: Gym & Fitness    Ideal For: Boys, Girls, Men, Women",B0BPNZV6F6,"Hang it Gym Bag It Is Superior Quality Gym Bag . It Is Also Useful As Gym Bag, Small Travel Bag, Swimming Bag .The Bag Comes In A Material Which Is Specially Chosen For Gym Purpose with Leather Look And Is Long Lasting And Durable, You Can Use This Bag For Years And Will Be As Good As New. It Is Easy To Carry And Looks Very Elegant And Stylish, It Is One Stylish Companion For Your Everyday Visit To The Gym. It Is Suited For Men As Well As Women And Will Look Very Stylish With Your Gym Wear. The Bag Has A Compartment Deep Enough For You To Store Your Essential Items for extra carrying capacity. Shaker: Perfect utility item for mixing shakes and other healthy drinks. Trendy shaker bottle with scientifically designed mesh for lump free smooth shake. Leak proof and highly durable. Recommended for mixing protein drinks at gyms or during outdoor sports.",Hang it
"Strong stitching at major stress points provide long-lasting durability against daily activities    Mesh side water bottle pocket. Adjustable shoulder strap.    This bag is made out of high tensile Main large compartment with double zip closure. Tough high durability fabricpolyester fabric which is known for being strong and water-repellent    High quality double zippers, easy to access. Highly water-resistant finish to save inner items from water splashes    Comes in attractive color combinations.",B07NLB6FRS,"The NIVIA BASIC GYM BAG is a classic gym bag choice, it's a compact gym bag, has a compartment and mesh bottle pockets. Made with high quality accessories and zipper, this bag has adjustable shoulder strap for better comfort, it will keep your stuff organized and carry it comfortably through the day.",Unknown
