Description,ASIN,Product Description,Manufacturer
"Care Instructions: Wipe with Damp Cloth    PADDED LAPTOP COMPARTMENT WITH MAXED OUT STORAGE : Generous 32 Ltrs backpack with Dimension of 32 Cm x 22 Cm x 45 Cm, 2 full size compartments, 1 front zipper & 2 side pockets, Fits upto 15.6 inches Laptop with elasticated strap lock at just 590 grams.    CRAFTED WITH PRECISION : Made with strong, water resistant Polyester fabric and faux leather for a lightweight and durable finish. Our polestar Vintage backpack is a blend of style and utility. A classic design with opulent detailing and vegan leather material adds to your style and keeps your belongings safe.    COMFORTABLE CARRY : This strong and impervious backpack is a fabulous choice for daily use. Guaranteed for strength and durability, it has padded breathable mesh back and adjustable straps. The interiors have added foam padding to protected electronics. Ergo-Grip Backstraps that distribute weight evenly over your shoulders and back, while the integrated top grab handle lets you move effortlessly.    BENEFITS: 2 main compartments provide optimal organisation, with premium zippers keeping your valuables protected, two side water bottle pockets help keep your goods dry and body hydrated.    VERSATILITY : This made in india versatile backpack comes with 12 months warranty, and is perfect for everyone, men, women, students, boys & girls, can be used as school, college, office or day travelling backpacks. All in one VINTAGE BACKPACK by Polestar.",B081GSQ9D9,"DURABLE AND PREMIUM   Made with strong, water resistant Polyester fabric for a lightweight and durable finish. Our polestar rucksack is designed thoughtfully for your perfect on the go lifestyle.  



  ERGONOMIC DESIGN   Made for maximum Comfort, it has padded breathable mesh back and adjustable straps. S-curved Ergo-Grip straps that distribute weight evenly over your shoulders and back.  



 VERSATILITY   We aim to provide optimal organisation with 2 main compartments, premium zippers, 1 front pocket and 2 side water bottle pockets along with easy to carry top Loop.",POLESTAR
"BACKPACK FOR PROFESSIONALS: Backpack with Laptop Compartment and organization for Books & other items. A spacious main compartments & one Front Zipper Pocket. A great backpack for working professionals and students     DURABLE MATERIAL: Extra-large backpack: 18x12x06 (inches), Capacity: 22L separate laptop compartment hold for 15.6 inches Laptop. The Large backpack made from high quality polyester fabric. Laptop pocket designed for your laptops to give them maximum security. It comes with Pen Pocket and Power Bank Pocket which aids in organising your things systematically     SMART & EFFICIENT: This big backpack is crafted specially for professional needs. This bag accommodate your daily essentials with ease. It can easily carry your work from office to home while giving you some space for your needs too. Most suitable for working professional along with college students.     COMFORTABLE: This backpack comes with comfortable wide breathable shoulder straps well-padded materials that helps relieve the stress from your shoulder. It has adjustable chest straps for equal weight-distribution. Along with compact-squeezing straps that lets you squeeze your, while making it look slimmer, providing extra strength for heavy articles too.; WARRANTY: Cosmus Branded Backpack comes with One year Manufacturer Warranty.; Age Range Description: Adult     Pattern Name: Solid",B08R7M639Z,Not Mentioned,Unknown
"?WATER RESISTANT WITH 1 YEAR WARRANTY - Stylish and durable unisex travel laptop backpack that is your perfect travel partner. Size: 20 inch X 13.5 inch X 9.5 inch. Capacity : 48 liters. Backpack is made of high grade water resistant polyester material that gives it strength and durable for long-term use. 12 months warranty for any manufacturing defects     ?MADE IN INDIA - This “MAKE IN INDIA” Product features 3 large zippered compartments, 1 zip pocket at front, 2 side bottle pockets. This is a perfect laptop, office, school, college bag for men, women, boys and girls     ?PADDED LAPTOP SLEEVE AND INTERNAL ORGANISER : Padded Laptop sleeve with holder to secure upto 15.6"" Laptops. Compatible with laptops like HP / Lenovo / Acer / ASUS / Dell. Internal organiser to neatly organise and store your keys, cables, stationary and other valuables from theft     ?1 YEAR WARRANTY - We offer 1 Year warranty for any manufacturing defects; ?BEST BACK SUPPORT - We have designed the bag keeping your comfort in mind. Shoulder has 12MM high density padding, with 3D ventilated air foam padding to prevent sweating when you use the bag; Pattern Name: Solid; Age Range Description: Adult; Color Name: Mblue; Special Features: Laptop Compartment; Pattern Name: Solid; Age Range Description: Adult     Style Name: Casual Backpack; Compartment Description: Up To 15 Inches",B08YZ5XY31,Not Mentioned,"Akshaya Rubbers, Hebbal Industrial Area, Mysore"
"SPACIOUS AND LIGHTWEIGHT: Light weight and spacious laptop backpack with 3 compartments. One compartment is for carrying laptop inside (Upto 17 inches), with padding for safety, and space for laptop accessories like charger, etc. Second large compartment for books, files and all your day to day essentials. And third compartment is for your extra stuff. It has provision for holding bottles on both sides and has padded shoulder straps for your comfort    COMFORT WITH QUALITY: This casual bag has Wide, Padded and Adjustable shoulder straps and Padded Back for comfort in carrying heavy items. Stitched properly and Bartacks on every pressure point for extra durability. Made with strong yet light weight polyester fabric with heavy zippers, It comes with a 9 Month Warranty. Serves the need of a professional office laptop bag, college bag, student backpack, school bag and is suitable for all, i.e. boys, girls, men and women    PREMIUM FABRIC : Premium Polyester, Stylish and durable backpack for school /college and travel. Easily accommodate a laptop. Size: 45 cm X 31 cm X 22 cm    BACK SUPPORT: We have designed the bag keeping your comfort in mind. Shoulder has high density padding, with 3D ventilated air foam padding to prevent sweating when you use the bag & to help you lift heavy objects easily.    OTHER FEATURES: Strong and durable zippers, 9 Months Warranty, Adjustable Shoulder Handles (Straps) , 2 Bottle/Umbrella holders , Padded Handle , Padded Laptop Compartment (can carry laptops of size 13, 14, 15.6 & 17 inches), Reflector Logo.",B085MHDJ93,Not Mentioned,Amazing Bags
"Laptop Compatibility: Yes, Laptop size: 15.6 inches    Outer Material: Polyester, Color: Black    Water Resistance: Water resistant    Dimensions: 33 cms x 17.5 cms x 47 cms (LxWxH)    Warranty type: Manufacturer; 12 months warranty against manufacturing defects",B01LXNNFDF,Not Mentioned,Backpack International Pvt Ltd
Lightweight and comfortable to carry    All your everyday essentials at your fingertips    Dependable everyday companion,B07PMQTB6T,"Keep your laptop, tablet and everyday essentials securely protected within the Dell Pro Slim Backpack 15 (PO1520PS), a slim-fit backpack designed for work and beyond",Unknown
"Laptop Compatibility: No, Strap Type: Adjustable    Outer Material: Polyester, Color: Blue    Water Resistance: Water resistant, Capacity: 29 liters; Dimensions: 33 x 51 x 22 cms (LxHxW)    Number of Wheels: 0, Number of compartments: 3    Mesh Padding on back & shoulder strap to provide comfort & better back support",B07CJCFNZG,Not Mentioned,Samsonite
"The Lino wheel Duffle Bag from Lavie Sport is a voluminous yet lightweight travel duffle. Made of high quality and durable materials, it provides the same function as a large-sized suitcase.Perfect travel duffle for weekend getaways.    Built to last: This duffle bag for travel features a combi-lock, shoulder strap, fully lined interior and is built with high-quality polyester fabric for the utmost durability. Made from water repellent & premium zippers, it makes it a super durable and lightweight all-weather travel duffle bag.    Plenty of Space & Easy to carry: The front side features a zippered pocket that is perfect to store quick access essentials. Lino luggage bags for travel have sturdy heavy-duty treaded rubber wheels in a protective wheel housing and retractable trolley for smooth mobility and maximum durability.    External Dimension: Length – 63cm, Width – 30cm, Height – 32cm, Capacity - 60 Litres.    Manufacturer warranty - 2 years",B097RJ22Q3,This unisex stylish travel Bag is made of premium nylon fabric which is the most durable material. It is water and scratch resistant. It has a full lining made of polyester for additional strength and protection for your valuables.,Bagzone Lifestyle Pvt Ltd
"MULTI-FUNCTION COMPARTMENT: HALF MOON backpack features multiple storage compartments and features for additional supplies and accessories as your, iPhone, iPad, pen, keys, wallet, books, clothes, bottle, passport and more.     DURABLE MATERIAL: Superior quality durable ECO Friendly waterproof and anti-scratch polyester and featuring a reinforced bottom to withstand heavy use, perfect for business, travel, school and other outdoor activities     COMFORTABLE DESIGN: Our backpack's ""S"" Curve adjustable, heavily padded shoulder straps and back panel make the backpack comfortable to wear even when loaded with all your gear; Compact:Backpack has a roomy Three compartment, front zipper pockets to hold small accessories, one internal security zippered pocket for valuable items and side pockets for water bottle or umbrella.     Size:18*13*10 inch(L*W*H), Capacity: 35L which is bigger than others of the same style. Good size for school, camping, travel, shopping, hiking, climbing, vintage backpack for men and women.; OTHER FEATURES: Laptop compartment, Internal Organiser(Small Pockets), Strong and durable zippers, Adjustable Shoulder Handles (Straps) , 2 Bottle/Umbrella holders , Padded Handle , Padded Laptop Compartment , Ergonomic Design, Reflector Logo, etc     Age Range Description: Kid; Pocket Description: Utility Pocket; Special Features: Water Resistant; Pattern Name: Solid; Water Resistance Level: Water Resistant",B0BLVQ9NTD,"A super-slim design, trendy looks and durable construction - this stylish 35 L backpack from Half Moon has got everything that will complement your youthful personality. With its spacious interiors, this unisex backpack is a great option for short road trips, college and work. Ergonomic design Crafted from polyester, this medium backpack is sturdy enough to withstand regular wear and tear gracefully. It features a cushioned base and internal back padding to offer you extra comfort. The padded shoulder straps of this bag can be easily adjusted according to your liking. Spacious Featuring one front pocket and three main compartments, all with speciality zippers, this bag offers you enough space to carry your books, files, coins, travel accessories, stationery, keys and mobile accessories. It comes with the Half Moon promise of quality.",Half_Moon
"External Size (LxWxH): 250x150x200 mm, Internal Size (LxWxH): 230x110x180 mm    Accommodates all Entry Level & Mid Range Digital SLR Cameras with 18-55mm Lens attached + 55 to 250mm lens + Charger & cable , filter , Memory card and other accessories.Waterproof Rain Cover is included for Hustle-free outdoor activities.    back zipper pocket for keys, cards, chargers and other storage; Inner compartment zipper net bag for SD card box, filter cloth, or cleaning kit storage.Two side net pockets. Adjustable shoulder carrying strap.    Polyurethane coating super nylon Water shield Material. With inside detachable divider to adjust the inside space for camera, lens and accessories.    Package Includes: 1*waterproof Camera Case Bag 1*Shoulder Strap 1*Rain Cover 1*Spacer Pad",B09P74TZY8,"Polyurethane coating super nylon Water shield Material. With inside detachable divider to adjust the inside space for camera, lens and accessories.",Sidrum
Care Instructions: Wipe with Damp Cloth    Number Lock: This Fur Jaden Anti Theft laptop backpack comes equipped with a Number Lock. This helps keep your laptop and other belongings safe when you need to leave your bag unattended in a public space. The number lock sequence can be changed and customised by your directly.    USB Charging Port: Now charge your devices on the go with your new Fur Jaden backpack without the hassle of carrying a bulk power bank in your pocket/ hand at all times.    Ergonomic Design: This backpack has been designed to ensure equal weight distribution on your shoulders along with padded shoulder straps and breathable air mesh on the back.    Dimension: 42 CM (L) x 30 CM (W) x 18 CM (D). Storage Capacity: 25L. Weight: 600 Grams; Warranty: 1 Year Manufacturer Warranty against Manufacturing Defects    Age Range Description: Adult; Closure Type: Zipper; Lining Description: Polyester,B09VTDMRY7,"Stay organized all day with a durable and lightweight backpack from Fur Jaden. This back pack is a stylish and functional accessory for men and women. Can add admiration to an appealing and daring personality with a remarkable aesthetics and functionality. This backpack features an anti-theft design. You can also charge your phone on the go and organize your stuff like pro. Fur Jaden functional back pack is apt to protect your gadgets and belongings from being stolen while you travel, thanks to its special anti-theft design. Now keep your belongings safe with style. The backpack features multiple compartments that you may use for your laptop and other essentials. A remarkable feature of this backpack allows you to charge your phone while you are on the move. With an attached charging dock in the back you may connect a portable power bank with ease. Weighing about 600grams, this backpack is lightweight. The backpack is able to house a laptop of up to 15.6 inches and has seven inner compartments to place your other essentials. Made from durable quality polymer this Fur Jaden back pack is sturdy and reliable. Flaunt this bag with style and low maintenance as this bag is washable. This backpack is also suitable for school or college. The straps are designed to distribute the weight equally on each shoulder preventing any sort of discomfort. Use this back pack for office, college/school or during travels.",FUR JADEN
"KEY FEATURES - Black Colour Backpack for Men and Women for Stylish Office use as well as for Trendy College students. Huge compartment size that can fit upto a 15.6 inch Laptop with ease. Multiple pockets for other accessories.    Charging On the Go - Now charge your phone on the go while travelling without the hassle of holding the bulky power bank in your pocket or in your hand. Simple Connect your Powerbank to the wire inside the Bag and leave it in the bag. When you want to charge your phone, just connect your phone charger to the bag and your phone will start charging. Note: We do not provide Power Bank with this Bag.    Anti Theft Design - This backpack by Fur Jaden has anti theft design where zipper of the main pocket is hidden at the back. No thief, intruder or robber can find a way to open the backpack, making this totally theft proof. There are secret pockets on the shoulder strap and on the backside of the bag allowing us to keep travel documents, boarding pass, credit cards, mobile phone, earphones etc.    Durable and Sturdy - Made from durable quality polymer fabric, this Fur Jaden backpack is sturdy and reliable. Flaunt this bag with style and enjoy life with this low maintenance bag which is also washable. This backpack is also suitable for school or college.    Warranty - 1 Year Manufacturer Warranty Against Manufacturing Defects",B078GLXMDY,"This durable and lightweight backpack from Fur Jaden can keep you sorted throughout the day while also being super stylish, thus making it the perfect modern and functional accessory for any user – male or female. This backpack can be the perfect complement to your bold and charismatic persona, while its multiple inner chambers can hold all your stuff with convenience. Fur Jaden backpacks are young, vibrant and fashionable accessories which are also a symbol of sophistication. This backpack is high on aesthetics as well as on utility and functionality. This unisex backpack from Fur Jaden comes in an anti-theft design which lets you carry your laptop anywhere with confidence. Keep your belongings secure as your score high on the style quotient with this functional backpack. One of the most striking features of this backpack is that it allows you to charge your phone while you are travelling. The charging dock which comes attached to the backpack allows you to connect your portable charger seamlessly for maximum convenience.The material of this backpack from Fur Jaden is water resistant, which keeps any worries about getting it wet in the rain or accidental splashes at bay. Your laptop and every other belonging will stay safe from water as long as you keep them inside your backpack. This backpack from Fur Jaden comes with substantial capacity to accommodate your laptop and other goods with ease. The large capacity of this backpack can store laptops up to a 15.6 inches without any hassle. Weighing in at only 0.7kg, this Fur Jaden backpack with anti-theft feature is a breeze to carry around. Most of the weight you will feel is that of the goods you carry inside, as the backpack does not impose much weight on the user. This multipurpose and water resistant backpack from Fur Jaden can take you from day to night, thanks to its multiple compartments. With 1 main compartment and 7 small, inner pockets, it lets you store all your belongings and keeps them sorted too. Pattern: Solid.",Fur Jaden
"Outer material: synthetic, color: brown    Waterproof    Capacity: 20 liters; Weight: 560 grams; Dimensions: 48 cms x 32 cms x 14 cms (LxWxH)    Number of compartments: 2    Laptop compatibility: yes, laptop size: 16strap type: adjustable    Anti theft waterproof bag with anti sweat fabric on back and shoulder straps    USB and headphone cable slot",B07G4F6XFH,"Gear bags are designed for the quick commute as well for the long journey. these backpacks can be used as laptop bags,adventure bags and so on. Your favorite travel companion, The backpacks come with enough storage space to carry all your requirements.",Gear Merchandise PVT LTD
"Made with strong and premium 450D Polyester    Max padded 15.4"" Laptop compartment    Cool and stylish looks    Unique front quick access mesh pockets    Large front pocket for extra convenience",B0BP1QM6W5,"Made with strong and premium 450D Polyester Max padded 15.4"" Laptop compartment Cool and stylish looks Unique front quick access mesh pockets Large front pocket for extra convenience Available in smart colors",Backpack International Pvt Ltd
"PREMIUM MATERIAL: This multifunctional bag is made of quality Water Repellent polyester material in black color to protect your goods from water. For the inner lining, soft feel premium polyester is used. The hardware such as strengthened hooks, zippers and buckles used are wear resistant, smooth, and durable.     LARGE CAPACITY : Comes with 2 compartments with one separate cushioned laptop sleeve to hold 15. 6 inch Laptop. Additional front zipper pockets with an organiser to store magazine, pens, key,music, cosmetic, pen, charger, powerbank, cable etc. Side pockets for water bottles,umbrella. Back hidden anti theft pocket can hold your wallet,phone,etc     TROLLEY STRAP & CONVENIENCE : The insertible pull rod box design allows the bag to slide over the luggage handle for easy mobility during traveling. Comfortable airflow back ergonomics design with soft padding, gives you maximum back support. Breathable and adjustable shoulder straps relieve the stress of shoulder. Foam padded top handle for a long time carry on.     ONE YEAR WARRANTY: 1-year warranty on this bag against any manufacturing defects. Just keep your documents safe. Contact Red Lemon for any issues regarding the product and a resolution will be provided.; Lining texture: polyester     Pattern Name: Solid; Special Features: Laptop Compartment; Age Range Description: Adult",B0BGSV19KZ,Not Mentioned,
"Dual zipper elegant design, foldable and lightweight toiletry storage bag, with top hanging handle and little hanging hook     Keep traveling comfortably, have all your necessities right at hand, no more digging or dumping everything out to find what you need     This bag made of nylon and pearl cotton cushion (durable and lightweight, waterproof) with highest standard workmanship     Our will be your best side kick for travel, business trip, outdoors activities, car, boat and simple at home's bathroom or closet; Makeup bag waterproof for men and women's     Pattern Name: Solid; Age Range Description: Adult",B07W22LC2D,"Keep Your Bathroom Clutter-Free   When you’re on the road and vacationing, the last thing you need to deal with is a messy sink and bathroom countertop. So, we thought of a solution to keep all the spaces & places you’ll go fantastically free of clutter! The central storage compartment unzips to reveal a utility hook, letting you hang the entire organizer.  



 Top Carry Handle   The toiletry kit provides a reliable loop handle for comfortable carrying from the travel bag to the hotel bathroom or for hanging it in the closet or on a doorknob when not in use from a towel rack or shower rod – out of the way but still right where you need it. Keep everything neatly in place!  



 Superior Design & Construction   Water resistant nylon material is breathable and the bag fully opens to easily dry out any moisture. Reinforced stitching and heavy-duty zippers let this organizer bag hold up to anything your travels can throw at it!Bring whatever you need with you to the gym, fitness classes, sports training, beach days, water parks, the pool and sauna sessions.",PETRICE
"♥ Makeup bag Open flat for easy access: The flat makeup bag has a large opening design for quick access to items, making it a must-have bag for travel, not only it is durable but also exquisite workmanship;    ♥ Large capacity and Clear compartments: The cosmetic bag can hold many small items, such as various makeup brushes, lipsticks, small eye shadow trays, cosmetics, etc. There are 3 pockets and 2 compartments inside the cosmetic bag, which can be sorted and stored so that your Life is more orderly;    ♥ Waterproof and wipeable: The make up bag is not only waterproof on the outside, can be wiped quickly, and stain-resistant, but also the inside of the make up bag is waterproof, can be wiped quickly, and stain-resistant. If lotion is poured on it, just wipe it off with a paper towel. Keep your makeup bag clean and flawless forever;    ♥ Multifunctional storage bag: Our makeup organizer bag can be used as a cosmetic bag, a toiletry bag, a pencil bag, and a daily storage bag; it can be used by any people and can store various small items in all aspects;    ♥ Perfect gift :Show your appreciation to your friend, wife, girlfriend, mother. This fashion portable bag is a thoughtful gift to women who are driven to looking good.It would be a great gift for women and girls,Mother's day /woman day/Birthday/Christmas Gift.",B0BR123Z9J,bag,
"Outer Material: Fabric, Color: Black; Water resistant    Capacity: 21 liters; Weight: 480 grams; Dimensions: 18 inches x 13 inches x 5 inches (LxWxH)    Number of compartments: 2    Laptop Compatibility: Yes, Laptop Size: 15 inches    Pocket Description: Utility Pocket; Closure Type: Zipper; Age Range Description: Adult; Style Name: Traditional Backpacks; Special Features: Laptop Compartment; Lining Description: Nylon    Fits upto 15"",Side mesh pocket for water bottle",B07FC4D9B5,"Fits upto 15 inch. Side mesh pocket for water bottle. Padded back system for carrying comfort. Webbing haul loop. Internal organizer. Material Specifications: 420D Poly Ripstop coated, 210D Nylon Poly Melange, 420D TM Poly Dobby.",Wildcraft
"Outer Material: Polyester, Color: Sea Blue    Not water resistant. With Rain Cover:No    Capacity: 15 liters; Weight: 200 grams; Dimensions: 12 cms x 27 cms x 41 cms (LxWxH)    Number of compartments: 2; Laptop Compatibility: No    Age Range Description: Kid; Closure Type: Drawstring; Pocket Description: Utility Pocket    Drawstring, 2 Compartments, Compact Size",B07Q7CNPMV,"Be it your short trips or your daily travel across the city, daypack has got you covered. With a 15 litre capacity daypack lets you carry your wallet, umbrella, kerchief, keys, earphones, Notepad, pens and other Essentials. The drawstring compartment lets you dump things that you pick up on your way. Compact Size and 2 Compartment.",Safari Industries (India) Ltd
"Combination of functional & safety features in stylish design, Soft mesh back with 8 mm foam padded 2 Main Compartment, 1 Slip In Pocket inside the bag, Printed Design, Mesh bottle holder on the side,",B08Z21W4TG,"Ideal for a college student who does not carry a lot of books or laptop to college. Very stylish, slim and feature loaded Backpack",VIP Industries Ltd
